{
  "name": "pulse-3",
  "type": "registry:ui",
  "description": "Pulse 3 animated SVG loader",
  "dependencies": [],
  "registryDependencies": [],
  "files": [
    {
      "path": "registry/new-york-v4/loaders/pulse-3.tsx",
      "type": "registry:ui",
      "target": "components/ui/loaders/pulse-3.tsx"
    }
  ]
}
