{
  "name": "6-dots-scale",
  "type": "registry:ui",
  "description": "6 Dots Scale animated SVG loader",
  "dependencies": [],
  "registryDependencies": [],
  "files": [
    {
      "path": "registry/new-york-v4/loaders/6-dots-scale.tsx",
      "type": "registry:ui",
      "target": "components/ui/loaders/6-dots-scale.tsx"
    }
  ]
}
