{
  "name": "separator",
  "type": "registry:ui",
  "description": "Separator component",
  "dependencies": [],
  "registryDependencies": [],
  "files": [
    {
      "path": "registry/new-york-v4/ui/separator.tsx",
      "type": "registry:ui",
      "target": "components/ui/separator.tsx"
    }
  ]
}
