{
  "name": "collapsible",
  "type": "registry:ui",
  "description": "Collapsible component",
  "dependencies": [],
  "registryDependencies": [],
  "files": [
    {
      "path": "registry/new-york-v4/ui/collapsible.tsx",
      "type": "registry:ui",
      "target": "components/ui/collapsible.tsx"
    }
  ]
}
