{
  "name": "accordion",
  "type": "registry:ui",
  "description": "Accordion component",
  "dependencies": [],
  "registryDependencies": [],
  "files": [
    {
      "path": "registry/new-york-v4/ui/accordion.tsx",
      "type": "registry:ui",
      "target": "components/ui/accordion.tsx"
    }
  ]
}
