{
  "name": "Installation",
  "type": "registry:ui",
  "description": "Installation component",
  "dependencies": [],
  "registryDependencies": [],
  "files": [
    {
      "path": "registry/new-york-v4/ui/Installation.tsx",
      "type": "registry:ui",
      "target": "components/ui/Installation.tsx"
    }
  ]
}
