{
  "name": "InteractiveDemo",
  "type": "registry:ui",
  "description": "Interactivedemo component",
  "dependencies": [],
  "registryDependencies": [],
  "files": [
    {
      "path": "registry/new-york-v4/ui/InteractiveDemo.tsx",
      "type": "registry:ui",
      "target": "components/ui/InteractiveDemo.tsx"
    }
  ]
}
