{
  "name": "3-dots-move",
  "type": "registry:ui",
  "description": "3 Dots Move animated SVG loader",
  "dependencies": [],
  "registryDependencies": [],
  "files": [
    {
      "path": "registry/new-york-v4/loaders/3-dots-move.tsx",
      "type": "registry:ui",
      "target": "components/ui/loaders/3-dots-move.tsx"
    }
  ]
}
